{
  "schema_version": 1,
  "search_space_id": "call-aec-limiter-research-v1",
  "strategy": "cartesian",
  "max_candidates": 32,
  "baseline": {
    "aec_mu": 0.22,
    "ns_floor": 0.12,
    "agc_target_dbfs": -20.0,
    "limiter_dbfs": -2.0
  },
  "parameters": {
    "ns_floor": [0.06, 0.07],
    "agc_target_dbfs": [-16.0],
    "limiter_dbfs": [-14.0, -12.0, -10.0],
    "aec_mu": [0.22, 0.24, 0.26]
  },
  "objective": {
    "minimum_improvement_score": 0.10,
    "metrics": [
      {"name": "pass_rate", "direction": "max", "weight": 10.0, "scale": 0.02, "max_regression": 0.0},
      {"name": "p10_near_si_sdr_improvement_db", "direction": "max", "weight": 1.4, "scale": 1.0, "max_regression": 0.75},
      {"name": "p10_noise_only_attenuation_db", "direction": "max", "weight": 0.8, "scale": 1.0, "max_regression": 0.75},
      {"name": "median_erle_db", "direction": "max", "weight": 1.0, "scale": 1.0, "max_regression": 1.0},
      {"name": "min_vad_f1", "direction": "max", "weight": 1.0, "scale": 0.05, "max_regression": 0.05},
      {"name": "max_vad_false_positive_rate", "direction": "min", "weight": 0.6, "scale": 0.05, "max_regression": 0.05},
      {"name": "max_output_clip_fraction", "direction": "min", "weight": 2.0, "scale": 0.002, "max_regression": 0.002}
    ],
    "case_delta_gates": [
      {"metric": "near_si_sdr_improvement_db", "stat": "min", "minimum_delta": -0.75, "min_cases": 4},
      {"metric": "noise_only_attenuation_db", "stat": "min", "minimum_delta": -0.75, "min_cases": 4},
      {"metric": "vad_f1", "stat": "min", "minimum_delta": -0.05, "min_cases": 4},
      {"metric": "vad_false_positive_rate", "stat": "max", "maximum_delta": 0.05, "min_cases": 4},
      {"metric": "output_clip_fraction", "stat": "max", "maximum_delta": 0.002, "min_cases": 4}
    ]
  }
}
